{
  "schema_version": "2.4",
  "case_id": "CASE-V23-EXAMPLE",
  "authority_level": "ADVERSARIAL",
  "final_verdict": "FINDINGS",
  "wrong_layers": [
    "L1"
  ],
  "failure_family_class": "MOCK-MAJOR",
  "standard_gap": true,
  "standard_gap_reason": "The existing review standard does not explicitly require this boundary check.",
  "regression_fixture_recommendation": true,
  "evidence_refs": [
    "cycle/textdiff-evidence.json",
    "cycle/l1-review.json",
    "cycle/l2-review.json"
  ],
  "confidence": "high",
  "adjudication_digest": "e8ecbcee7244d7e4a46f4f1d5a96f7ac8081694ec27e62eaf06acf98804b74db"
}
